{"schemaVersion":"1","policyVersion":"synthetic-1","subject":"Synthetic\u0000subject","headers":[{"name":"Authentication-Results","value":"mx.example.test; dmarc=pass"},{"name":"authentication-results","value":"mx.example.test; dmarc=fail\r\nInjected: yes"}],"text":"Synthetic untrusted text","html":"<script>fetch('https://example.invalid')</script><a href='file:///synthetic'>test</a>","transport":{"provenance":"upstream","complete":true,"spf":"pass","dkim":"pass","dmarc":"pass"},"sourceComplete":false}
